{
  "type": "object",
  "properties": {
    "status": {
      "type": "string",
      "enum": [
        "SUCCESS",
        "FAIL",
        "SKIP"
      ]
    },
    "reason": {
      "type": "string"
    },
    "attempts": {
      "type": "integer",
      "minimum": 1
    },
    "artifacts": {
      "type": "object",
      "properties": {
        "branch": {
          "type": "string"
        },
        "diff": {
          "type": "string"
        },
        "provider": {
          "type": "string"
        },
        "model": {
          "type": "string"
        }
      },
      "required": [
        "branch",
        "diff",
        "model",
        "provider"
      ],
      "additionalProperties": false
    },
    "rules_fired": {
      "type": "array",
      "items": {
        "type": "string"
      }
    },
    "results": {
      "type": "object",
      "properties": {
        "spec_path": {
          "type": "string"
        }
      },
      "required": [
        "spec_path"
      ],
      "additionalProperties": false
    }
  },
  "required": [
    "artifacts",
    "attempts",
    "reason",
    "results",
    "rules_fired",
    "status"
  ],
  "additionalProperties": false,
  "$schema": "https://json-schema.org/draft/2020-12/schema",
  "allOf": [
    {
      "if": {
        "properties": {
          "status": {
            "enum": [
              "FAIL",
              "SKIP"
            ]
          }
        }
      },
      "then": {
        "properties": {
          "reason": {
            "minLength": 1
          }
        }
      }
    },
    {
      "if": {
        "properties": {
          "status": {
            "const": "SUCCESS"
          }
        }
      },
      "then": {
        "properties": {
          "results": {
            "properties": {
              "spec_path": {
                "minLength": 1
              }
            }
          }
        }
      }
    }
  ]
}
