{
  "status": "FAIL",
  "reason": "Both required artifacts could not be written: the Write tool was denied for docs/35/SPEC.md and docs/35/behavior-scenarios.json, and this session is non-interactive so the permission prompt cannot be granted. Routing around the denial via Bash would be a sandbox bypass and was not attempted. docs/35/ exists and contains no prior SPEC.md, so this is not an approved-spec overwrite refusal. Research is complete and the spec is fully drafted; re-dispatch after granting write permission for docs/35/**. Verified findings: no ticket identity on observations (scripts/nightshift-run-metrics.py:459-475); cmd_summary is single-run only (:352-363); usage holds exactly input_tokens/output_tokens (:282-285) and reported_model is hardcoded None (:275, :433); nothing in the repo reads summary.json. Three extractor corrections: dedup lives in _summary (:391-392) not _read_events (:318-349); invocation_id is only run-unique because nightshift-factory.sh:471 and :511 both emit factory-$NIGHTSHIFT_RUN_ID, so a rollup must key on (run_id, invocation_id); _load_context:240 rejects any run dir disagreeing with the ambient NIGHTSHIFT_RUN_ID exported at nightshift-factory.sh:207, so a cross-run reader needs its own loader. Two unverified facts were kept out of the spec body and placed under Open Questions: whether claude -p --output-format json (the CLI at nightshift-agent.sh:207-218, not the Agent SDK) exposes total_cost_usd/modelUsage/cache fields, since the only envelope in the repo is the fixture stub at tests/test-run-metrics.sh:37; and Codex turn.completed usage field names, because WebFetch to the openai/codex source was denied, so Codex/local usage stays null as today. The Anthropic cost-tracking doc did fetch and is authoritative that result-level usage excludes subagents while total_cost_usd and modelUsage include them, and that both are client-side estimates not billing; the design therefore records per-receipt usage_scope, keeps billed_usd null with billed_status unknown always, and ships no pricing table. Mode Story; router decision nightshift-architect (5 files across scripts/, docs/, tests/ plus a new shared read contract). One scenario case, C8-observational-failure-and-allowlist, carries safety_sensitive risk requiring independent design challenge; all review fields authored null with no review approval claimed.",
  "attempts": 1,
  "artifacts": {
    "branch": "nightshift/35",
    "diff": "",
    "model": "opus",
    "provider": "claude"
  },
  "results": {
    "spec_path": ""
  },
  "rules_fired": [
    "read-only-spec-phase",
    "cite-or-omit",
    "not-found-identifiers-to-open-questions",
    "verify-provider-formats-against-authoritative-sources",
    "mark-proposed-identifiers-after-collision-check",
    "minimize-scope",
    "accounting-observational-never-gating",
    "no-token-derived-pricing-initial-delivery",
    "review-fields-remain-null",
    "no-fabricated-review-approval",
    "structured-failure-return"
  ]
}
